"nct_id","phase_token","status_token","failure_token","failure_confidence","intervention_type","endpoint_category","endpoint_miss","sponsor_type","enrollment_ratio","duration_months","condition_token","why_stopped_raw","primary_endpoint_raw"
"NCT00642109","NA","TERMINATED","UNKNOWN","0","PROCEDURE","OTHER","False","OTHER",,"57","stress urinary incontinence","higher incidence of pain related sexual dysfunction in the TO arm","Urodynamic stress urinary incontinence measurement"
"NCT02460016","PHASE1","TERMINATED","EXTERNAL","0.6","DRUG","SAFETY","False","INDUSTRY",,"2.2","respiratory syncytial virus infections","We switched this study design to another study per IEC's recommendations.","Number of Adverse Events"
"NCT00259714","PHASE1","TERMINATED","UNKNOWN","0","DRUG","OTHER","False","OTHER",,"25","hypertension","Protocol was not feasible - only 1 of 18 enrollees completed procedures.","BP changes on 44-h ABPM"
"NCT00857233","PHASE3","TERMINATED","UNKNOWN","0","DRUG","SAFETY","False","INDUSTRY",,"76","alzheimer's disease","Please see explanation in the Detailed Description field.","Number of Patients With Adverse Events (AEs)"
"NCT01604252","NA","TERMINATED","SAFETY","0.6","OTHER","RESPONSE_RATE","False","INDUSTRY",,"58.2","basal cell carcinoma","The study was terminated early by the Sponsor due to the high rate of discontinuation of subjects unrelated to patient safety.","Response rate"
"NCT03201952","PHASE1","TERMINATED","ENROLLMENT","0.6","DRUG","BIOMARKER","False","OTHER",,"26.9","glucose intolerance","Difficulty in participant recruitment","Change in glucose level"
"NCT06227247","NA","TERMINATED","ENROLLMENT","0.8","OTHER","OTHER","False","OTHER",,"10.1","gestational diabetes","Recruitment pace was not sufficient to support fully-powered efficacy trial. Study investigators decided to terminate the feasibility trial before reaching recruitment target.","Acceptability (Participate Again)"
"NCT04125147","NA","TERMINATED","ENROLLMENT","0.8","DEVICE","OTHER","False","INDUSTRY",,"43.5","fused vertebrae","Low enrollment","Hemostasis"
"NCT01393847","NA","TERMINATED","UNKNOWN","0","OTHER","BIOMARKER","False","NIH",,"29.6","sickle cell disease",,"Difference in whole blood gene expression in the peripheral blood of sickle cell subjects and matched controls during pain and pain-free states."
"NCT03039738","NA","TERMINATED","UNKNOWN","0","DEVICE","OTHER","False","INDUSTRY",,"9.1","telemetry","Medtronic shift in strategic direction for study device","Hospital Length of Stay (LOS) as Assessed by Review of Medical Records"
"NCT05395858","NA","TERMINATED","BUSINESS","0.6","OTHER","OTHER","False","INDUSTRY",,"9.6","hemophilia a","Bayer business decision to close the REAL study based on the following: Target objective of enrolling at least 20 patients into the retrospective part failed; Not enough available data that would be a meaningful addition to the literature.","Frequency of damoctocog alfa pegol infusions"
"NCT04921358","PHASE3","TERMINATED","SAFETY","0.8","DRUG","SURVIVAL","False","INDUSTRY",,"28.8","non-small cell lung cancer (nsclc)","Due to safety risks and unfavorable risk-benefit assessment results, the sponsor has decided to voluntarily terminate the study.","Overall Survival (OS)"
"NCT03348748","NA","TERMINATED","ENROLLMENT","0.8","OTHER","SAFETY","False","OTHER",,"94.7","stage i non-small cell lung cancer ajcc v7","low accrual","Incidence of treatment-related grade 3-5 adverse events assessed using the National Cancer Institute (NCI) Common Terminology Criteria for Adverse Events (CTCAE) version (v)4.0"
"NCT02395848","PHASE3","TERMINATED","BUSINESS","0.6","DRUG","OTHER","False","OTHER",,"74","clostridium difficile infection","Insufficient resource to complete the study","Clinical Response at 30-day Completion of Fidaxomicin"
"NCT03610048","PHASE3","TERMINATED","BUSINESS","0.6","DRUG","SAFETY","False","INDUSTRY",,"20.7","refractory major depressive disorder","Sponsor Decision","Number of Subjects With Treatment-emergent Adverse Events (TEAEs)"
"NCT00561548","NA","TERMINATED","UNKNOWN","0","PROCEDURE","OTHER","False","OTHER",,"23","crohn disease",,"Relative variation (%) in apoptotic cells calculated according to the formula: (% of induced apoptotic cells) - (% of spontaneous apoptotic cells)"
"NCT04770155","NA","TERMINATED","UNKNOWN","0","OTHER","OTHER","False","OTHER",,"3.8","vascular function","Despite significant effort, we were unable to obtain the supply of drugs and supplements needed for the various arms of this Clinical Trial.","Flow-mediated Dilation"
"NCT00636155","PHASE2","TERMINATED","BUSINESS","0.6","DRUG","RESPONSE_RATE","False","OTHER",,"51","lymphoma, small lymphocytic","funding","Number of Patients With an Overall Response (Complete Response + Partial Response)"
"NCT01506726","PHASE2","TERMINATED","UNKNOWN","0","DRUG","BIOMARKER","False","OTHER",,"32","anemia","Study drug expiration and supply shortage","Change in Hemoglobin Level From Baseline to 6 Month Visit"
"NCT05027178","NA","TERMINATED","UNKNOWN","0","OTHER","OTHER","False","OTHER",,"26.8","stroke","The study is being reformatted and will have a different protocol for the relaunch.","Stroke Impact Scale Survey"
"NCT02990078","NA","TERMINATED","UNKNOWN","0","DRUG","OTHER","False","OTHER",,"69.9","tbi","Sufficient sample size enrolled to demonstrate scientific goals of the study","Change in CVR prior to sildenafil administration"
"NCT06613685","PHASE2","TERMINATED","BUSINESS","0.6","DRUG","OTHER","False","INDUSTRY",,"16.8","hiv-1-infection","Sponsor decision to terminate study.","Phase 2: Proportion of Participants With HIV-1 RNA < 50 Copies/mL at Week 24 as Determined by the United States (US) Food and Drug Administration (FDA)-defined Snapshot Algorithm"
"NCT02558543","PHASE2","TERMINATED","UNKNOWN","0","DRUG","OTHER","False","OTHER",,"42","scleroderma, systemic",,"Cochin hand functional scale"
"NCT05639543","PHASE2","TERMINATED","SAFETY","0.6","DRUG","OTHER","False","INDUSTRY",,"37.9","alcohol associated hepatitis","Intercept made the business decision to terminate the study on 31 Mar 2026 as there was no clear evidence of potential benefit of INT-787 in sAH. This decision was not based on a safety concern.","Lille model response based on Lille score by treatment group"
"NCT05198843","PHASE1","TERMINATED","ENROLLMENT","0.6","DRUG","SAFETY","False","NIH",,"13.4","anatomic stage iv breast cancer ajcc v8","Other - Poor accrual","Maximum Tolerated Dose (MTD) for Dasatinib and Icosapent Ethyl (EPA) Combination Therapy (Phase 1b)"
"NCT03428815","NA","TERMINATED","EXTERNAL","0.6","DEVICE","OTHER","False","OTHER",,"19.8","artificial limbs","Pandemic response invalidated long-term outcome data collection","Days Without Prosthesis"
"NCT00570908","PHASE2","TERMINATED","ENROLLMENT","0.6","DRUG","SURVIVAL","False","OTHER",,"55","breast cancer","Due to poor accrual this study is being closed to accrual","Progression Free Survival"
"NCT03707925","NA","TERMINATED","ENROLLMENT","0.8","PROCEDURE","OTHER","False","OTHER",,"40.1","lung carcinoid tumor","Very slow accrual rate","Pathologic Changes From Bronchoscopic Laser Ablation of Peripheral Lung Tumors"
"NCT05062512","NA","TERMINATED","BUSINESS","0.6","OTHER","BIOMARKER","False","OTHER",,"19.1","neuro-degenerative disease","Funding not renewed.","Generate behavioural/functional profiles from the wearable biosensors"
"NCT02353000","NA","TERMINATED","UNKNOWN","0","OTHER","QOL","False","OTHER",,"41","neoplasm metastasis","Unable to achieve accrural within anticipated timeframe","Quality of life in patients with 4 - 10 brain metastases comparing WBRT and SRS"
"NCT02688907","PHASE2","TERMINATED","UNKNOWN","0","DRUG","RESPONSE_RATE","False","OTHER",,"27.2","small cell lung cancer","change regimen","Objective response rate (ORR) by RECIST 1.1"
"NCT01099592","PHASE4","TERMINATED","ENROLLMENT","0.6","DRUG","OTHER","False","OTHER",,"5","acute coronary syndrome","inability to recruit","Changes from baseline to 12 weeks in depression levels on the 24-item Hamilton Depression Rating Scale (HAMD-24)"
"NCT00862836","PHASE1","TERMINATED","EFFICACY","0.8","DRUG","SAFETY","False","INDUSTRY",,"17","ovarian cancer","Lack of efficacy","Description (on the Basis of the Safety Set): Safety and Tolerability by Means of the Incidence and Type of Adverse Events (AEs)."
"NCT02975336","PHASE2","TERMINATED","UNKNOWN","0","DRUG","OTHER","False","INDUSTRY",,"38.6","systemic lupus erythematosus","Study is completed; primary analysis completed.","DBPC Period: Number of Participants With Response Based on Systemic Lupus Erythematosus Responder Index 4 (SRI-4) at Week 52"
"NCT00622011","PHASE4","TERMINATED","UNKNOWN","0","DRUG","OTHER","False","OTHER",,"14","delirium","inadequate participant","Delirium rating scale"
"NCT05996744","PHASE2","TERMINATED","REGULATORY","0.6","DRUG","BIOMARKER","False","INDUSTRY",,"1.9","covid-19","Study was terminated by Sponsor; the decision was not due to any safety findings.","Plasma Concentration of GS-441524, Metabolite of Obeldesivir (ODV)"
"NCT05229744","NA","TERMINATED","ENROLLMENT","0.6","DEVICE","OTHER","False","ACADEMIC",,"28.2","endolymphatic hydrops","The study was discontinued due to lack of inclusion.","the prevalence of at least one endolymphatic hydrops in patients with a history of congenital CMV infection with symptomatic cochleovestibular dysfunction"
"NCT01938664","PHASE2","TERMINATED","EFFICACY","0.6","DRUG","OTHER","False","OTHER",,"42","cocaine dependence","Results of interim efficacy analysis showed results were not promising.","# of Participants With Presence of Cocaine Metabolites Via Urinalysis"
"NCT06448364","PHASE1","TERMINATED","BUSINESS","0.6","BIOLOGICAL","OTHER","False","INDUSTRY",,"3.2","advanced or metastatic solid tumors","Strategic business decision","PART 1: Number of participants with Dose-limiting toxicities (DLT)"
"NCT01555021","NA","TERMINATED","EXTERNAL","0.6","OTHER","OTHER","False","OTHER",,"7","treatment resistant depression","The study was an inpatient, but PI left inpatient at MGH on July 1, 2012","Change in Quick Inventory of Depressive Symptoms-Self Rating (SR) 16 Item"
"NCT02634606","PHASE3","TERMINATED","ENROLLMENT","0.6","DRUG","OTHER","False","OTHER",,"55.7","hypercholesterolemia","Unable to obtain supplement for this study. Unable to recruit.","Change in LDL Cholesterol Over Time Between the 3 Groups"
"NCT01917006","PHASE2","TERMINATED","SAFETY","0.6","DRUG","OTHER","False","INDUSTRY",,"48.3","premature ejaculation","Strategic business decision was made to terminate the program. There were no safety concerns.","Change From Baseline in Geometric Mean Intravaginal Ejaculatory Latency Time (IELT)"
"NCT03777904","NA","TERMINATED","UNKNOWN","0","OTHER","OTHER","False","OTHER",,"9.6","iron overload","Analysis of first 11 subjects resulted in values that were too varied to make the study feasible.","Correlation of serum and urine ferritin levels"
"NCT00212004","PHASE4","TERMINATED","BUSINESS","0.6","DRUG","OTHER","False","OTHER",,"156","diabetes mellitus","Limited budget to continue this study","The time till the first cardiovascular composite endpoint"
"NCT03152084","PHASE4","TERMINATED","ENROLLMENT","0.6","DRUG","OTHER","False","INDUSTRY",,"32.3","diabetes mellitus, type 2","Poor recruitment.","Change in 24-hour Sodium Excretion From Baseline to Start of Treatment"
"NCT04557384","PHASE1","TERMINATED","UNKNOWN","0","DRUG","BIOMARKER","False","INDUSTRY",,"3","advanced solid tumor","Study terminated due to inadequate PK profile associated with the subcutaneous formulation.","Pharmacokinetics (PK): Area Under the Concentration Time Curve (AUC) of Ramucirumab"
"NCT04628052","NA","TERMINATED","EXTERNAL","0.6","PROCEDURE","OTHER","False","OTHER",,"27.4","procedural anxiety","Administratively Closed","Anxiety Score"
"NCT03727633","PHASE2","TERMINATED","BUSINESS","0.6","DRUG","OTHER","False","OTHER",,"89.5","carcinoma, hepatocellular","Enrollement rythm low, funding body decision.","Percentage of participants presenting a disease control at 4 months"
"NCT04331652","NA","TERMINATED","UNKNOWN","0","PROCEDURE","BIOMARKER","False","OTHER",,"17.2","polyps uterus","change of practices","Feasibility of polypectomy, with a mini-resectoscope of 15 bipolar careers, without general anesthesia or analgo-sedation"
"NCT00698347","NA","TERMINATED","UNKNOWN","0","DEVICE","OTHER","False","INDUSTRY",,"122","osteoarthritis, hip","Centers would not continue follow-up; two centers transitioned patients to a new study.","Harris Hip Score"
"NCT00005655","PHASE1","TERMINATED","UNKNOWN","0","BIOLOGICAL","SAFETY","False","NIH",,"202.1","kidney neoplasm",,"MTD and DLTof IL-12 in combination with IL-2"
"NCT04787926","NA","TERMINATED","ENROLLMENT","0.6","DEVICE","OTHER","False","INDUSTRY",,"20.2","catheter-related infections","Enrollment was low or halted with few to zero future anticipated enrollments.","Primary Catheter Patency"
"NCT05034978","NA","TERMINATED","EXTERNAL","0.6","OTHER","OTHER","False","OTHER",,"16.5","sars-cov2 infection","failure in enrolling eligible subjects during COVID-19 outbreaks","Test performance"
"NCT01476085","PHASE1","TERMINATED","UNKNOWN","0","OTHER","OTHER","False","INDUSTRY",,"3","cancer","Study terminated as ongoing analysis suggested objectives not practical to achieve with study as implemented","changes in [18F]ML10 uptake in tumours"
"NCT02125643","PHASE1","TERMINATED","UNKNOWN","0","DRUG","OTHER","False","OTHER",,"9","healthy","Protocol was deem insufficient to answer research question","change in maximal voluntary strength"
"NCT02326935","PHASE1","TERMINATED","UNKNOWN","0","BIOLOGICAL","OTHER","False","INDUSTRY",,"42.5","multiple sclerosis",,"Standard Complication Questionnaire"
"NCT00876317","PHASE3","TERMINATED","UNKNOWN","0","DRUG","OTHER","False","OTHER",,"13","soft tissue injuries of the shoulder","Change in current areas of research interest of the collaborator","Pain on active movement"
"NCT02734017","NA","TERMINATED","UNKNOWN","0","OTHER","OTHER","False","OTHER",,"32.7","re-hospitalization",,"Rate of readmission"
"NCT03456817","PHASE2","TERMINATED","SAFETY","0.8","DRUG","SURVIVAL","False","OTHER",,"59","graft-versus-host-disease","Slow patient accrual and appearance of a toxicity","moderate/severe chronic GVHD- and relapse-free survival (cGFRS) at 2 years post transplant"
"NCT00585117","NA","TERMINATED","UNKNOWN","0","PROCEDURE","BIOMARKER","False","OTHER",,"61","cns brain metastases","change in imaging priorities","To validate the CuATSM-PET imaging by correlation to the serum level of osteopontin, a marker of hypoxia"
"NCT02384850","PHASE1","TERMINATED","UNKNOWN","0","DRUG","OTHER","False","OTHER",,"24.3","colorectal neoplasm",,"Numbers of Patients With Dose Limiting Toxicities"
"NCT02080091","NA","TERMINATED","UNKNOWN","0","OTHER","OTHER","False","INDUSTRY",,"16","diabetic macular edema (dme)",,"Visual Acuity"
"NCT02139774","NA","TERMINATED","ENROLLMENT","0.6","OTHER","OTHER","False","OTHER",,"8","prostate cancer","inadequate accrual","To measure the feasibility of implementing the WWE intervention among men age >65 with a prostate cancer diagnosis"
"NCT00868374","PHASE3","TERMINATED","ENROLLMENT","0.8","DRUG","OTHER","False","OTHER",,"40","major depressive disorder","Study terminated due to low enrollment","Change in 17 Item Hamilton Rating Scale for Depression (HAM-D-17)"
"NCT02963090","PHASE2","TERMINATED","ENROLLMENT","0.6","DRUG","SURVIVAL","False","OTHER",,"27","small cell lung cancer","Lack of enrollment","Progression Free Survival"
"NCT02807597","PHASE1","TERMINATED","ENROLLMENT","0.6","DRUG","SAFETY","False","OTHER",,"23.3","breast cancer","Before LS301's licensing and reformulation, 9 patients received LS301-HSA (Phase 1a) , but since no patients were recruited (in Phase 1b) before the product expired, this study has been terminated.","Number of Participants With Related Adverse Events of LS301 in Breast (Phase I)"
"NCT03929497","PHASE2","TERMINATED","EFFICACY","0.8","DRUG","SAFETY","False","INDUSTRY",,"16.8","schizophrenia","Lack of efficacy based on the interim analysis in the 17972A study","Number of participants with Treatment-Emergent Adverse Events"
"NCT01541397","NA","TERMINATED","UNKNOWN","0","DRUG","OTHER","False","OTHER",,"14","hyperphenylalaninemia",,"Bone Mineral Density"
"NCT01617213","PHASE2","TERMINATED","UNKNOWN","0","DRUG","SURVIVAL","False","OTHER",,,"multiple myeloma","Study is no longer needed as recent data have answered the primary hypotheses for this study.","Event Free Survival"
"NCT02927860","NA","TERMINATED","UNKNOWN","0","OTHER","OTHER","False","OTHER",,"10.2","thoracic surgery","Fitbit was not giving the necessary data.","Length of Stay"
"NCT01083160","NA","TERMINATED","ENROLLMENT","0.8","OTHER","OTHER","False","INDUSTRY",,"31","rheumatoid arthritis","The study was terminated due to low enrollment because inclusion criteria are obsolete.","DAS28 (Disease Activity Score in 28 Joints)"
"NCT02271516","PHASE1","TERMINATED","UNKNOWN","0","OTHER","SAFETY","False","OTHER",,"2","tumors","Some concerns arose for the accumulation of radioactivity in liver and spleen.","Determine the MTD"
"NCT04563806","NA","TERMINATED","UNKNOWN","0","DEVICE","SAFETY","False","OTHER",,"37","thoracic spine neoplasm","Per PI","Incidence of intraoperative adverse events"
"NCT01104506","NA","TERMINATED","UNKNOWN","0","PROCEDURE","OTHER","False","OTHER",,"5","painful avulsion of brachial plexus",,"Identify the 2 muscles (lateral and medial) lining the representation of superior member according to Penfield's homunculus."
"NCT01762033","PHASE2","TERMINATED","UNKNOWN","0","DRUG","SURVIVAL","False","INDUSTRY",,"30.9","renal cell carcinoma",,"Progression-Free Survival"
"NCT00204152","PHASE3","TERMINATED","EXTERNAL","0.6","OTHER","OTHER","False","OTHER",,"24","major depressive disorder","PI left U of C","severity of depression, measured by Longitudinal Interval Follow-up Evaluation (LIFE; Keller et al., 1982; Keller et al., 1987), Beck Depression Inventory-II (BDI-II; Beck, Steer, & Brown, 1996a), and Hamilton Rating Scale for Depression."
"NCT01043952","NA","TERMINATED","ENROLLMENT","0.8","DRUG","OTHER","False","OTHER",,"26","anesthesia, general","Poor enrollment.","Time to extubation since the interruption in the administration of anaesthetics."
"NCT00349752","PHASE3","TERMINATED","ENROLLMENT","0.6","BIOLOGICAL","RESPONSE_RATE","False","INDUSTRY",,"32","crohn's disease","Recruitment was stopped early due to slow enrolment of this population. With no safety concerns, the study continued normally for subjects already recruited","Percentage of Subjects Who Have Been Withdrawn From Prednisone or Prednisolone Therapy According to the Corticosteroid Tapering Schedule and Have Remained Off Corticosteroids and in Disease Remission at Week 38"
"NCT00134238","PHASE3","TERMINATED","UNKNOWN","0","DRUG","OTHER","False","INDUSTRY",,"37","mixed hyperlipidemia",,"Change in intima media thickness as measured by carotid ultrasound"
"NCT00734526","PHASE1","TERMINATED","UNKNOWN","0","DRUG","SAFETY","False","OTHER",,"47.4","glioblastoma",,"Phase I: Sorafenib Maximum Tolerated Dose (MTD)"
"NCT01579578","PHASE2","TERMINATED","BUSINESS","0.6","DRUG","OTHER","False","INDUSTRY",,"11","metastatic, gastric or gastro-oesophageal junction, cancer","AstraZeneca sponsored trials of AZD8931 have been halted","Change in Tumour Size at 8 Weeks Were Analyzed for Comparing Relative Efficacy of AZD8931 Plus Paclitaxel With Paclitaxel Alone"
"NCT02681185","NA","TERMINATED","ENROLLMENT","0.6","OTHER","OTHER","False","OTHER",,"64.1","diabetes mellitus","enrollment not satisfied","HbA1c"
"NCT04585815","PHASE1","TERMINATED","REGULATORY","0.6","DRUG","OTHER","False","INDUSTRY",,"47.6","carcinoma, non-small-cell lung","Study was terminated due to portfolio re-prioritization and strategic considerations. The decision was not based on any safety concerns and/or regulatory interactions","Phase 1b of Sub-Study A: Percentage of Participants With Dose-Limiting Toxicities (DLT)"
"NCT01337635","NA","TERMINATED","ENROLLMENT","0.6","DRUG","OTHER","False","OTHER",,"29","atopic dermatitis","Not meeting enrollment goals.","Atopic Dermatitis Severity at the Completion of Treatment"
"NCT05559125","PHASE1","TERMINATED","EXTERNAL","0.6","DRUG","SAFETY","False","INDUSTRY",,"16.6","healthy subject","Due to the COVID-19 epidemic situation, the sponsor has decided to terminate the project.","Incidence of Adverse Events, Clinically Significant Laboratory Abnormalities, Clinically Significant ElectrocardiogramãVital Signs And Physical Examination Abnormalities."
"NCT04949425","PHASE1","TERMINATED","UNKNOWN","0","DRUG","SAFETY","False","INDUSTRY",,"7.2","advanced solid tumours","Study terminated because the clinical development programme for Adavosertib has been discontinued","Number of patients with serious and non-serious adverse events"
"NCT02588040","NA","TERMINATED","ENROLLMENT","0.6","BIOLOGICAL","OTHER","False","INDUSTRY",,"16","lateral epicondylitis","Not enough sites available to complete enrollment in a timely manner","The primary objective of the study will be to measure number of patients who achieve resolution of chronic LE symptoms at 6 months following initial injection with Recover L-PRP."
"NCT04789889","NA","TERMINATED","UNKNOWN","0","OTHER","OTHER","False","OTHER",,"48","quality of life","The intraoperative radiotherapy machine was out of order and could not be used.","Rate of successful surgical procedure"
"NCT02855268","PHASE2","TERMINATED","REGULATORY","0.6","DRUG","SAFETY","False","INDUSTRY",,"34.7","alport syndrome","The results of the futility analysis led to the study termination. No unexpected safety findings were identified.","Number of Participants With Treatment-emergent Adverse Events (TEAEs) and Treatment-emergent Serious Adverse Events (TESAEs)"
"NCT05386368","PHASE4","TERMINATED","ENROLLMENT","0.8","DRUG","OTHER","False","OTHER",,"13.5","carbon dioxide laser","Study halted prematurely and will not resume; participants are no longer being examined or receiving intervention. PI decided to terminate due to slow enrollment.","Change in Skin Sensitivity Scores - Redness"
"NCT00685750","NA","TERMINATED","UNKNOWN","0","PROCEDURE","BIOMARKER","False","INDUSTRY",,"67.6","lung cancer, non-small cell","Slow enrolment over the last 2 years with none in the past 1 year. No increase in the number of completed subjects for 1 year and no more ongoing study subjects","Number of Subjects With Expression of Tumor Antigens"
"NCT04078191","PHASE2","TERMINATED","BUSINESS","0.6","DRUG","BIOMARKER","False","INDUSTRY",,"33.8","rheumatoid arthritis","Sponsor decision.","Correlation Between Joint-specific Tilmanocept Uptake and CD206 Expression"
"NCT00453791","PHASE1","TERMINATED","UNKNOWN","0","DRUG","SAFETY","False","INDUSTRY",,"2","asthma",,"Safety and tolerability parameters will be compared between active and placebo treatment groups using summary statistics. No formal statistical analyses of the safety and tolerability data will be performed."
"NCT00124891","PHASE2","TERMINATED","UNKNOWN","0","DRUG","OTHER","False","INDUSTRY",,"17","arrhythmias",,"The total number of ventricular beats recorded by Holter monitoring during the 24 hr. on-therapy phase."
"NCT01315418","NA","TERMINATED","UNKNOWN","0","OTHER","OTHER","True","INDUSTRY",,"7","upper respiratory tract infections",,
"NCT02478710","PHASE4","TERMINATED","UNKNOWN","0","DRUG","OTHER","False","OTHER",,"85","pneumonia, ventilator-associated",,"Recurrence of Pneumonia"
"NCT04757610","PHASE3","TERMINATED","EFFICACY","0.6","BIOLOGICAL","OTHER","False","INDUSTRY",,"48.6","neovascular age-related macular degeneration","The primary endpoint was not achieved in the study.","Mean Change in Early Treatment Diabetic Retinopathy Study (ETDRS) Best-corrected Visual Acuity (BCVA) Letters"
"NCT00630318","PHASE1","TERMINATED","UNKNOWN","0","DEVICE","OTHER","False","OTHER",,"28","breast abnormalities","Unable to accrue enough subjects to analyze data.","To provide preliminary data for a larger study that this type of imaging can be used to monitor the effectiveness of anti-angiogenic therapy."
"NCT01925118","PHASE2","TERMINATED","UNKNOWN","0","BIOLOGICAL","RESPONSE_RATE","False","OTHER",,"21","metastatic malignant melanoma and renal cell carcinoma","Ineffectiveness","12-week modified immune-related response rate"
"NCT06886620","PHASE3","TERMINATED","UNKNOWN","0","DRUG","OTHER","False","INDUSTRY",,"10.9","intermittent claudication",,"Geometric mean percent change in initial claudication distance (ICD)"
"NCT01363310","PHASE3","TERMINATED","BUSINESS","0.6","DRUG","OTHER","False","OTHER",,"28.1","depression with prominent agitation","Termination of sponsorship","Change from baseline to endpoint in the Hamilton Depression Rating Scale 17-Item (HAMD-17) total score"
"NCT02289482","PHASE1","TERMINATED","REGULATORY","0.8","DRUG","SAFETY","False","INDUSTRY",,"3.7","infection, human immunodeficiency virus","Study prematurely terminated due to safety concerns leading to clinical hold","Adverse events (AEs) assessments"
"NCT03076606","NA","TERMINATED","UNKNOWN","0","OTHER","OTHER","False","OTHER",,"37.5","visual acuity","recruiting issues and unavailable ophtalmologists","visual acuity values concordance between nurses and ophthalmologist"
"NCT02287506","NA","TERMINATED","ENROLLMENT","0.6","OTHER","OTHER","False","OTHER",,"9.1","diabetes","Pilot feasibility for full trial: NCT03737799","Time to optimum treatment following diagnosis."
"NCT02132884","NA","TERMINATED","ENROLLMENT","0.6","OTHER","SURVIVAL","False","OTHER",,"17","malignant pericardial effusion","Feasibility","Progression Free Survival"
"NCT04545333","NA","TERMINATED","UNKNOWN","0","OTHER","OTHER","False","INDUSTRY",,"35.6","acute lymphoblastic leukemia, adult b-cell","Sufficient data collected.","Distribution of timepoints at which MRD is monitored using the clonoSEQ Assay in lymphoid malignancy patients in real world settings"
